[
  {
    "category": "room_template",
    "id": "room_combat_pillared_hall",
    "schema_version": 1,
    "name_key": "ROOM_COMBAT_PILLARED_HALL_NAME",
    "description_key": "ROOM_COMBAT_PILLARED_HALL_DESC",
    "availability": [
      "LAUNCH",
      "EXPANSION"
    ],
    "room_type": "combat",
    "scene_path": "res://data/content_packs/base/assets/rooms/launch/room_combat_pillared_hall.tscn",
    "floor_ids": [
      "floor_ruins_of_remnant",
      "floor_void_forest",
      "floor_time_rift",
      "floor_plane_forge",
      "floor_throne_of_void"
    ],
    "door_anchors": [
      {
        "id": "door_west",
        "direction": "west",
        "position": {
          "x": 16,
          "y": 180
        }
      },
      {
        "id": "door_east",
        "direction": "east",
        "position": {
          "x": 624,
          "y": 180
        }
      }
    ],
    "camera_bounds": {
      "x": 0,
      "y": 0,
      "width": 640,
      "height": 360
    },
    "spawn_anchors": [
      {
        "id": "player_entry",
        "kind": "player",
        "position": {
          "x": 160,
          "y": 280
        }
      },
      {
        "id": "enemy_wave_primary",
        "kind": "enemy",
        "position": {
          "x": 320,
          "y": 160
        }
      }
    ],
    "interaction_anchors": [
      {
        "id": "room_exit",
        "kind": "exit",
        "position": {
          "x": 608,
          "y": 180
        }
      }
    ],
    "supported_environment_rule_ids": [
      "rule_crumbling_ground",
      "rule_void_spores",
      "rule_temporal_distortion",
      "rule_forge_vents",
      "rule_collapsing_plane"
    ],
    "accessibility_safe_hazard_zones": [
      {
        "id": "safe_core",
        "bounds": {
          "x": 224,
          "y": 96,
          "width": 192,
          "height": 168
        }
      }
    ],
    "thumbnail_id": "thumb_room_combat_pillared_hall",
    "icon_id": "icon_combat_room"
  },
  {
    "category": "room_template",
    "id": "room_combat_split_chambers",
    "schema_version": 1,
    "name_key": "ROOM_COMBAT_SPLIT_CHAMBERS_NAME",
    "description_key": "ROOM_COMBAT_SPLIT_CHAMBERS_DESC",
    "availability": [
      "LAUNCH",
      "EXPANSION"
    ],
    "room_type": "combat",
    "scene_path": "res://data/content_packs/base/assets/rooms/launch/room_combat_split_chambers.tscn",
    "floor_ids": [
      "floor_ruins_of_remnant",
      "floor_void_forest",
      "floor_time_rift",
      "floor_plane_forge",
      "floor_throne_of_void"
    ],
    "door_anchors": [
      {
        "id": "door_west",
        "direction": "west",
        "position": {
          "x": 16,
          "y": 180
        }
      },
      {
        "id": "door_east",
        "direction": "east",
        "position": {
          "x": 624,
          "y": 180
        }
      }
    ],
    "camera_bounds": {
      "x": 0,
      "y": 0,
      "width": 640,
      "height": 360
    },
    "spawn_anchors": [
      {
        "id": "player_entry",
        "kind": "player",
        "position": {
          "x": 160,
          "y": 280
        }
      },
      {
        "id": "enemy_wave_primary",
        "kind": "enemy",
        "position": {
          "x": 320,
          "y": 160
        }
      }
    ],
    "interaction_anchors": [
      {
        "id": "room_exit",
        "kind": "exit",
        "position": {
          "x": 608,
          "y": 180
        }
      }
    ],
    "supported_environment_rule_ids": [
      "rule_crumbling_ground",
      "rule_void_spores",
      "rule_temporal_distortion",
      "rule_forge_vents",
      "rule_collapsing_plane"
    ],
    "accessibility_safe_hazard_zones": [
      {
        "id": "safe_core",
        "bounds": {
          "x": 224,
          "y": 96,
          "width": 192,
          "height": 168
        }
      }
    ],
    "thumbnail_id": "thumb_room_combat_split_chambers",
    "icon_id": "icon_combat_room"
  },
  {
    "category": "room_template",
    "id": "room_combat_open_field",
    "schema_version": 1,
    "name_key": "ROOM_COMBAT_OPEN_FIELD_NAME",
    "description_key": "ROOM_COMBAT_OPEN_FIELD_DESC",
    "availability": [
      "LAUNCH",
      "EXPANSION"
    ],
    "room_type": "combat",
    "scene_path": "res://data/content_packs/base/assets/rooms/launch/room_combat_open_field.tscn",
    "floor_ids": [
      "floor_ruins_of_remnant",
      "floor_void_forest",
      "floor_time_rift",
      "floor_plane_forge",
      "floor_throne_of_void"
    ],
    "door_anchors": [
      {
        "id": "door_west",
        "direction": "west",
        "position": {
          "x": 16,
          "y": 180
        }
      },
      {
        "id": "door_east",
        "direction": "east",
        "position": {
          "x": 624,
          "y": 180
        }
      }
    ],
    "camera_bounds": {
      "x": 0,
      "y": 0,
      "width": 640,
      "height": 360
    },
    "spawn_anchors": [
      {
        "id": "player_entry",
        "kind": "player",
        "position": {
          "x": 160,
          "y": 280
        }
      },
      {
        "id": "enemy_wave_primary",
        "kind": "enemy",
        "position": {
          "x": 320,
          "y": 160
        }
      }
    ],
    "interaction_anchors": [
      {
        "id": "room_exit",
        "kind": "exit",
        "position": {
          "x": 608,
          "y": 180
        }
      }
    ],
    "supported_environment_rule_ids": [
      "rule_crumbling_ground",
      "rule_void_spores",
      "rule_temporal_distortion",
      "rule_forge_vents",
      "rule_collapsing_plane"
    ],
    "accessibility_safe_hazard_zones": [
      {
        "id": "safe_core",
        "bounds": {
          "x": 224,
          "y": 96,
          "width": 192,
          "height": 168
        }
      }
    ],
    "thumbnail_id": "thumb_room_combat_open_field",
    "icon_id": "icon_combat_room"
  },
  {
    "category": "room_template",
    "id": "room_combat_l_corner",
    "schema_version": 1,
    "name_key": "ROOM_COMBAT_L_CORNER_NAME",
    "description_key": "ROOM_COMBAT_L_CORNER_DESC",
    "availability": [
      "LAUNCH",
      "EXPANSION"
    ],
    "room_type": "combat",
    "scene_path": "res://data/content_packs/base/assets/rooms/launch/room_combat_l_corner.tscn",
    "floor_ids": [
      "floor_ruins_of_remnant",
      "floor_void_forest",
      "floor_time_rift",
      "floor_plane_forge",
      "floor_throne_of_void"
    ],
    "door_anchors": [
      {
        "id": "door_west",
        "direction": "west",
        "position": {
          "x": 16,
          "y": 180
        }
      },
      {
        "id": "door_east",
        "direction": "east",
        "position": {
          "x": 624,
          "y": 180
        }
      }
    ],
    "camera_bounds": {
      "x": 0,
      "y": 0,
      "width": 640,
      "height": 360
    },
    "spawn_anchors": [
      {
        "id": "player_entry",
        "kind": "player",
        "position": {
          "x": 160,
          "y": 280
        }
      },
      {
        "id": "enemy_wave_primary",
        "kind": "enemy",
        "position": {
          "x": 320,
          "y": 160
        }
      }
    ],
    "interaction_anchors": [
      {
        "id": "room_exit",
        "kind": "exit",
        "position": {
          "x": 608,
          "y": 180
        }
      }
    ],
    "supported_environment_rule_ids": [
      "rule_crumbling_ground",
      "rule_void_spores",
      "rule_temporal_distortion",
      "rule_forge_vents",
      "rule_collapsing_plane"
    ],
    "accessibility_safe_hazard_zones": [
      {
        "id": "safe_core",
        "bounds": {
          "x": 224,
          "y": 96,
          "width": 192,
          "height": 168
        }
      }
    ],
    "thumbnail_id": "thumb_room_combat_l_corner",
    "icon_id": "icon_combat_room"
  },
  {
    "category": "room_template",
    "id": "room_combat_crossroads",
    "schema_version": 1,
    "name_key": "ROOM_COMBAT_CROSSROADS_NAME",
    "description_key": "ROOM_COMBAT_CROSSROADS_DESC",
    "availability": [
      "LAUNCH",
      "EXPANSION"
    ],
    "room_type": "combat",
    "scene_path": "res://data/content_packs/base/assets/rooms/launch/room_combat_crossroads.tscn",
    "floor_ids": [
      "floor_ruins_of_remnant",
      "floor_void_forest",
      "floor_time_rift",
      "floor_plane_forge",
      "floor_throne_of_void"
    ],
    "door_anchors": [
      {
        "id": "door_west",
        "direction": "west",
        "position": {
          "x": 16,
          "y": 180
        }
      },
      {
        "id": "door_east",
        "direction": "east",
        "position": {
          "x": 624,
          "y": 180
        }
      }
    ],
    "camera_bounds": {
      "x": 0,
      "y": 0,
      "width": 640,
      "height": 360
    },
    "spawn_anchors": [
      {
        "id": "player_entry",
        "kind": "player",
        "position": {
          "x": 160,
          "y": 280
        }
      },
      {
        "id": "enemy_wave_primary",
        "kind": "enemy",
        "position": {
          "x": 320,
          "y": 160
        }
      }
    ],
    "interaction_anchors": [
      {
        "id": "room_exit",
        "kind": "exit",
        "position": {
          "x": 608,
          "y": 180
        }
      }
    ],
    "supported_environment_rule_ids": [
      "rule_crumbling_ground",
      "rule_void_spores",
      "rule_temporal_distortion",
      "rule_forge_vents",
      "rule_collapsing_plane"
    ],
    "accessibility_safe_hazard_zones": [
      {
        "id": "safe_core",
        "bounds": {
          "x": 224,
          "y": 96,
          "width": 192,
          "height": 168
        }
      }
    ],
    "thumbnail_id": "thumb_room_combat_crossroads",
    "icon_id": "icon_combat_room"
  },
  {
    "category": "room_template",
    "id": "room_combat_high_ground",
    "schema_version": 1,
    "name_key": "ROOM_COMBAT_HIGH_GROUND_NAME",